{
  "target": "/mnt/windows",
  "timestamp": "2008-11-20T01:14:59.961826+00:00",
  "partition": {
    "total_gb": 116.44,
    "used_gb": 107.87,
    "free_gb": 8.57,
    "used_pct": 92.6
  },
  "verdict": "WARNING",
  "top_dirs": [
    {
      "path": "Users",
      "size_mb": 60022.4
    },
    {
      "path": "Users/Garnet Tregonning",
      "size_mb": 58380.9
    },
    {
      "path": "Windows",
      "size_mb": 25080.6
    },
    {
      "path": "System Volume Information",
      "size_mb": 18485.3
    },
    {
      "path": "Windows/winsxs",
      "size_mb": 12101.1
    },
    {
      "path": "$RECYCLE.BIN",
      "size_mb": 5677.0
    },
    {
      "path": "Program Files",
      "size_mb": 3775.0
    },
    {
      "path": "Windows/SoftwareDistribution",
      "size_mb": 3577.5
    },
    {
      "path": "Windows/System32",
      "size_mb": 3259.3
    },
    {
      "path": "Windows/Installer",
      "size_mb": 2743.9
    },
    {
      "path": "ProgramData",
      "size_mb": 1934.7
    },
    {
      "path": "Users/Public",
      "size_mb": 1640.1
    },
    {
      "path": "Windows/assembly",
      "size_mb": 821.9
    },
    {
      "path": "Program Files/Common Files",
      "size_mb": 651.2
    },
    {
      "path": "Program Files/Google",
      "size_mb": 564.4
    }
  ],
  "temp_dirs": [
    {
      "path": "Windows/Temp",
      "size_mb": 206.4
    },
    {
      "path": "Windows/SoftwareDistribution/Download",
      "size_mb": 3255.5
    },
    {
      "path": "Windows/Prefetch",
      "size_mb": 39.9
    },
    {
      "path": "Users/Default/AppData/Local/Temp",
      "size_mb": 0.0
    },
    {
      "path": "Users/Default User/AppData/Local/Temp",
      "size_mb": 0.0
    },
    {
      "path": "Users/Garnet Tregonning/AppData/Local/Temp",
      "size_mb": 6540.5
    },
    {
      "path": "Users/Default/AppData/Local/Microsoft/Windows/Temporary Internet Files",
      "size_mb": 0.0
    },
    {
      "path": "Users/Default User/AppData/Local/Microsoft/Windows/Temporary Internet Files",
      "size_mb": 0.0
    },
    {
      "path": "Users/Garnet Tregonning/AppData/Local/Microsoft/Windows/Temporary Internet Files",
      "size_mb": 13.7
    },
    {
      "path": "Users/Garnet Tregonning/AppData/LocalLow/Temp",
      "size_mb": 0.0
    }
  ],
  "total_temp_mb": 10056.0
}